image,caption
./coco_dataset/train2017/000000311081.jpg,A bathroom with white fixtures and tile floor
./coco_dataset/train2017/000000342971.jpg,A man catching a green Frisbee next to a  field.
./coco_dataset/train2017/000000231580.jpg,A man stands and holds his hands out in front of him.
./coco_dataset/train2017/000000484296.jpg,Two zebras relax in a wooded area near many trees
./coco_dataset/train2017/000000551304.jpg,A well decorated toilet seat with undecorated surroundings.
./coco_dataset/train2017/000000481159.jpg,A horse in a snowy paddock looking over the fence
./coco_dataset/train2017/000000221281.jpg,two giraffes running across a field in the mud
./coco_dataset/train2017/000000462629.jpg,A number of vintage refrigerators and freezers sitting outdoors.
./coco_dataset/train2017/000000281032.jpg,A man with his hair tied back prepares food. 
./coco_dataset/train2017/000000112997.jpg,a man is seen holding a very old cellphone 
./coco_dataset/train2017/000000448810.jpg,A street sign sitting on the side of a road.
./coco_dataset/train2017/000000024144.jpg,A large cheese pizza in a cardboard box.
./coco_dataset/train2017/000000371699.jpg,A classroom has letters on the wall and a dog on the floor.
./coco_dataset/train2017/000000416451.jpg,People using video game controllers in a living room.
./coco_dataset/train2017/000000404484.jpg,Lady in her living room playing with the dog.
./coco_dataset/train2017/000000342186.jpg,A pizza with toppings served on a plate
./coco_dataset/train2017/000000283070.jpg,One whole orange joins one sliced orange on a wooden surface.
./coco_dataset/train2017/000000439623.jpg,A white fire hydrant sitting on a  sidewalk.
./coco_dataset/train2017/000000429281.jpg,Bananas and apples are being sold at the market.
./coco_dataset/train2017/000000434996.jpg,A pile of stuffed animals sitting on top of a bed.
./coco_dataset/train2017/000000110282.jpg,a stop light that is next to some trees and grass
./coco_dataset/train2017/000000572678.jpg,A white room with a large window and a glass dining table and white chairs.
./coco_dataset/train2017/000000344268.jpg,obama delivers a speech photoshopped with the ussr flag
./coco_dataset/train2017/000000565989.jpg,A large building with statues at the top of it . 
./coco_dataset/train2017/000000131273.jpg,A grey and white dog sitting in the passenger side of a car.
./coco_dataset/train2017/000000285047.jpg,A man with a cup of coffee and a cell phone.
./coco_dataset/train2017/000000183709.jpg,A group of people standing next to a crosswalk.
./coco_dataset/train2017/000000379332.jpg,A black and white photo of a man playing tennis.
./coco_dataset/train2017/000000192716.jpg,a street sign attached to a wooden pole
./coco_dataset/train2017/000000383384.jpg,Batter taking swing at ball during televised baseball game.
./coco_dataset/train2017/000000479155.jpg,A family shopping at a farmers marked with their dog.
./coco_dataset/train2017/000000128654.jpg,a person jumping in the air while playing with a frisbee
./coco_dataset/train2017/000000137294.jpg,a man outside cooking at an event and serving customers
./coco_dataset/train2017/000000309452.jpg,A yellow bird stands perched on a tree branch.
./coco_dataset/train2017/000000324258.jpg,Two men use all of their hands to play a video game.
./coco_dataset/train2017/000000341058.jpg,An umbrella is opened over an outdoor table.
./coco_dataset/train2017/000000215723.jpg,Two men in yellow jackets sitting at a table eating
./coco_dataset/train2017/000000453001.jpg,A young beautiful woman in a short jean skirt.
./coco_dataset/train2017/000000085195.jpg,A plate with an orange cake dessert and a fork.
./coco_dataset/train2017/000000210273.jpg,A highway filled with lots of traffic and buses.
./coco_dataset/train2017/000000171788.jpg,A man lunging to hit a tennis ball on a court
./coco_dataset/train2017/000000548339.jpg,a young boy holding a bat at a baseball game
./coco_dataset/train2017/000000022969.jpg,A large giraffe looks at a smaller giraffe looking over a fence.
./coco_dataset/train2017/000000112997.jpg,A person holding a walkie talkie in their left hand.
./coco_dataset/train2017/000000269932.jpg,A large red chair in front of a building.
./coco_dataset/train2017/000000517069.jpg,A woman sitting on a bench in the middle of the city
./coco_dataset/train2017/000000066817.jpg,This plate consists of rice with sauce and peas and meat patties on the side.
./coco_dataset/train2017/000000255912.jpg,Two plates full of food sitting on a table next to a bottle.
./coco_dataset/train2017/000000559842.jpg,people enjoying a game of kick ball with many younger ones involved
./coco_dataset/train2017/000000523100.jpg,A metal bowl filled with orange slices on a table.
./coco_dataset/train2017/000000050006.jpg,A lot of boats that is parked in the water and one is docking.
./coco_dataset/train2017/000000439426.jpg,A person is holding a doughnut that has a bite taken out of it. 
./coco_dataset/train2017/000000491867.jpg,This man has a paper flower and a green tie
./coco_dataset/train2017/000000426253.jpg,a microwave that has some food in it
./coco_dataset/train2017/000000434479.jpg,A slice of pizza covered in chocolate next to two dolls.
./coco_dataset/train2017/000000515577.jpg,A few people on skis skiing on a snowy mountain.
./coco_dataset/train2017/000000506707.jpg,A man in a white shirt and gray pants walks toward a grassy area as kids in baseball uniforms and an umpire are near him.
./coco_dataset/train2017/000000250766.jpg,Meat and a salad with knife and fork on a plate.
./coco_dataset/train2017/000000113403.jpg,"A white, beige and brown baby bear under a beige/white comforter."
./coco_dataset/train2017/000000471789.jpg,A pair of people flying a kite on a unique trail in a park.
./coco_dataset/train2017/000000224724.jpg,A woman is leaving a building in a city.
./coco_dataset/train2017/000000542089.jpg,A bathroom is outfitted with brown and white.
./coco_dataset/train2017/000000466085.jpg,A rundown bathroom is being stripped and remodeled.
./coco_dataset/train2017/000000026926.jpg,An orange fire hydrant with graffiti to look like a face.
./coco_dataset/train2017/000000479126.jpg,a couple of women sitting outside in a court yard 
./coco_dataset/train2017/000000482719.jpg,A clear glass bowl with bananas and plums in it. 
./coco_dataset/train2017/000000359677.jpg,A man is above the water enjoying some skiing. 
./coco_dataset/train2017/000000098018.jpg,a two burner stove a door a window and a table
./coco_dataset/train2017/000000056350.jpg,A picture of people is on the floor near a urinal.
./coco_dataset/train2017/000000203864.jpg,Two people standing on a tennis court playing tennis
./coco_dataset/train2017/000000289516.jpg,A clock that is surrounded by tall grass in a park.
./coco_dataset/train2017/000000190007.jpg,a man on surf board riding a wave over his head
./coco_dataset/train2017/000000580197.jpg,An older man in a tuxedo standing next to a younger man in a tuxedo wearing glasses.
./coco_dataset/train2017/000000534673.jpg,A blue and white bus with large windows on it.
./coco_dataset/train2017/000000488664.jpg,A train belches smoke and speeds down a city train track.
./coco_dataset/train2017/000000163117.jpg,A crowd of people standing on a field flying kites.
./coco_dataset/train2017/000000286422.jpg,A sailboat in a river with people and a dog on it. 
./coco_dataset/train2017/000000060932.jpg,A man in a suit that is standing in front of a group of people.
./coco_dataset/train2017/000000041633.jpg,An old model red Chevrolet truck is on the pavement.
./coco_dataset/train2017/000000451435.jpg,A tennis player preparing to swing at a ball.
./coco_dataset/train2017/000000533145.jpg,a person pointing a wii controller at a computer screen
./coco_dataset/train2017/000000453860.jpg,A couple of pieces of very nice looking luggage.
./coco_dataset/train2017/000000018193.jpg,a person eating an apple with a plate of food
./coco_dataset/train2017/000000514586.jpg,a boy in the middle of swinging a base ball bat
./coco_dataset/train2017/000000559348.jpg,a baseball player is about to make a pitch 
./coco_dataset/train2017/000000450439.jpg,"A red, white, and blue kite sails through the blue sky."
./coco_dataset/train2017/000000106912.jpg,a person rising a skate board in a lot 
./coco_dataset/train2017/000000001503.jpg,A computer on a desk next to a laptop.
./coco_dataset/train2017/000000246963.jpg,A large of people on motor bikes on a street.
./coco_dataset/train2017/000000219485.jpg,Cat in window sill of colored panes on building
./coco_dataset/train2017/000000397639.jpg,A ewe and her kid in a field.
./coco_dataset/train2017/000000445792.jpg,A woman playing a video game while sitting on a couch. 
./coco_dataset/train2017/000000532901.jpg,A daybed in a sitting rooms with a fireplace.
./coco_dataset/train2017/000000079229.jpg,A man riding a horse followed by a dog
./coco_dataset/train2017/000000269196.jpg,A knot of sheep are huddled close and looking out of a barbed wire fence with a frost-covered landscape behind them. 
./coco_dataset/train2017/000000194746.jpg,A pizza covered in cheese dripping down onto the bottom of an oven burning.
./coco_dataset/train2017/000000449312.jpg,A woman standing behind a counter where several desserts are displayed in a glass container.
./coco_dataset/train2017/000000006614.jpg,a black and white photo of nuts and fruit
./coco_dataset/train2017/000000320743.jpg,A group of men riding on the backs of small elephants.
./coco_dataset/train2017/000000514586.jpg,A young boy holding a baseball bat near a batting cage.
./coco_dataset/train2017/000000508312.jpg,A kitchen that has a double oven in the cabinets and a slay electric stove top in the counter.
./coco_dataset/train2017/000000185292.jpg,A man riding a wave on top of a surfboard.
./coco_dataset/train2017/000000334399.jpg,A clock that is standing on a table.
./coco_dataset/train2017/000000428111.jpg,a man that is on a skateboard that is on a ramp
./coco_dataset/train2017/000000530457.jpg,PIcked peach flowers sit in a vase with water.
./coco_dataset/train2017/000000292415.jpg,A guy rides his skate board in a half pipe. 
./coco_dataset/train2017/000000184384.jpg,A large piece of blueberry cake on a plate.
./coco_dataset/train2017/000000290833.jpg,A mother and baby zebra grazing on grass.
./coco_dataset/train2017/000000356125.jpg,Some very cute big  elephants by some people.
./coco_dataset/train2017/000000553788.jpg,A person laying on a bed in front of a laptop.
./coco_dataset/train2017/000000410880.jpg,Large stuffed bear sitting outside of a building.
./coco_dataset/train2017/000000385719.jpg,Three computers are shown at the wooden desk.
./coco_dataset/train2017/000000283717.jpg,A microwave sitting on top of a wooden shelf.
./coco_dataset/train2017/000000176232.jpg,Flowers are arranged in a vase sitting on a table.
./coco_dataset/train2017/000000087476.jpg,A person helping a child stand on a skateboard.
./coco_dataset/train2017/000000504635.jpg,Three zebras stand together in a field of grass.
./coco_dataset/train2017/000000250205.jpg,Two heron are standing on some rocks near some water.
./coco_dataset/train2017/000000314034.jpg,A herd of cattle is feeding at the river's edge.
./coco_dataset/train2017/000000052565.jpg,a cow stares as it stands next to a body of water 
./coco_dataset/train2017/000000383606.jpg,Compact hotel bathroom with corner basin and mirrors.
./coco_dataset/train2017/000000039785.jpg,A surfer is surfing in a wave simulator.
./coco_dataset/train2017/000000270677.jpg,Young man holding skateboard in front of fence.
./coco_dataset/train2017/000000449579.jpg,Woman in red shirt getting ready to hit tennis ball.
./coco_dataset/train2017/000000489339.jpg,A woman in a wet suite carrying a surf board.
./coco_dataset/train2017/000000504580.jpg,A couple giraffes staring in the same direction
./coco_dataset/train2017/000000150649.jpg,A man riding a skateboard up the side of a ramp.
./coco_dataset/train2017/000000482275.jpg,A bride and groom are cutting a cake as they smile.
./coco_dataset/train2017/000000290771.jpg,"Comfortable, modern living room overlooking a wooded area"
./coco_dataset/train2017/000000053994.jpg,A parking meter has a sign promoting the end to homelessness.
./coco_dataset/train2017/000000446207.jpg,A Sony camera and a cell phone are on a table.
./coco_dataset/train2017/000000368038.jpg,A long train filled with nothing but cabooses.
./coco_dataset/train2017/000000446005.jpg,A kitchen has wooden cabinets and black countertops.
./coco_dataset/train2017/000000377946.jpg,a yellow food truck parked on the side of a city street
./coco_dataset/train2017/000000380203.jpg,A white horse is out eating in a field
./coco_dataset/train2017/000000156071.jpg,A young child mutton busting at a rodeo event
./coco_dataset/train2017/000000231822.jpg,Cafeteria lunch fare is a balanced meal plus dessert.
./coco_dataset/train2017/000000074860.jpg,A man sitting on the ground with a snowboard on his feet.
./coco_dataset/train2017/000000561958.jpg,A group of people including small children wearing ski equipment standing in the snow.
./coco_dataset/train2017/000000541291.jpg,A dirty public restroom with sinks and mirrors.
./coco_dataset/train2017/000000186632.jpg,A hotel room with a chandelier and glass fixtures.
./coco_dataset/train2017/000000318238.jpg,two dachshunds and a cat sleep on a bed
./coco_dataset/train2017/000000478393.jpg,A bed with a cat sleeping on it next to a teddy bear and another cat.
./coco_dataset/train2017/000000481413.jpg,A very small boy on the beach with a disc.
./coco_dataset/train2017/000000097994.jpg,Three laptop computers and a desktop computer sit next to each other.
./coco_dataset/train2017/000000410510.jpg,A young man playing tennis as seen from above.
./coco_dataset/train2017/000000560178.jpg,A person's hand holding up a bitten radish.
./coco_dataset/train2017/000000186449.jpg,A black and white image of an old person sitting on a bench
./coco_dataset/train2017/000000455597.jpg,A worker passes through a cluttered restaurant kitchen.
./coco_dataset/train2017/000000064718.jpg,A man is swinging a tennis racket at a ball.
./coco_dataset/train2017/000000526256.jpg,Clocks may be seen on all sides of the tower.
./coco_dataset/train2017/000000075393.jpg,Carefully sculpted pieces of wood in a display case.
./coco_dataset/train2017/000000357888.jpg,A MAN IS STANDING IN HIS KITCHEN HOLDING A YELLOW KITE
./coco_dataset/train2017/000000002473.jpg,A man flying through the air while riding skis.
./coco_dataset/train2017/000000485237.jpg,Two planes are on a runway beside trucks.
./coco_dataset/train2017/000000203629.jpg,A man on a cell phone in a public area holding his thumb up.
./coco_dataset/train2017/000000486104.jpg,A baseball game is in action as a batter swings.
./coco_dataset/train2017/000000441247.jpg,The woman is working at the kitchen counter.
./coco_dataset/train2017/000000267169.jpg,a baby elephant drinking milk out of a bottle
./coco_dataset/train2017/000000156643.jpg,Person cutting cake at a theme restaurant characters in background.
./coco_dataset/train2017/000000220310.jpg,A teddy bear with a heart is in a green bin.
./coco_dataset/train2017/000000337055.jpg,a woman with a tattoo is sitting on the train tracks
./coco_dataset/train2017/000000028452.jpg,A fridge has some eggs and a bottle in it.
./coco_dataset/train2017/000000190753.jpg,A park scene includes men playing chess at folding tables.
./coco_dataset/train2017/000000269113.jpg,three dogs playing outdoors during a sunny day in the grass
./coco_dataset/train2017/000000308545.jpg,a young girl riding a white horse in front of other people 
./coco_dataset/train2017/000000355610.jpg,"A black and white photograph of a stuffed teddy bear wearing a shirt that reads ""handle with care"" and a small stuffed sheep."
./coco_dataset/train2017/000000558073.jpg,A striped cat sits in a bath tub.
./coco_dataset/train2017/000000576566.jpg,A somewhat blurry image of a young man in the air on his skateboard. 
./coco_dataset/train2017/000000465836.jpg,Three people cross country skiing in a field.
./coco_dataset/train2017/000000434204.jpg,A skateboarder with one fut on a skateboard raising it up.
./coco_dataset/train2017/000000488664.jpg,A train traveling on raised tracks near a town.
./coco_dataset/train2017/000000491497.jpg,The living room is empty with the television on. 
./coco_dataset/train2017/000000378515.jpg,People are crouched around in an open market.
./coco_dataset/train2017/000000146489.jpg,Half eaten pizza on cutting board next to alcohol.
./coco_dataset/train2017/000000386134.jpg,A Styrofoam container holding rice and other food.
./coco_dataset/train2017/000000115870.jpg,A few people are sitting on a long coach together
./coco_dataset/train2017/000000333956.jpg,A parking meter at the edge of the ocean with a boat behind it.
./coco_dataset/train2017/000000140076.jpg,"A dining room has a dining table and chairs, wall tapestry, and bar cart."
./coco_dataset/train2017/000000114770.jpg,"A large gun, a jeep, a motorcycle, and a warplane are in front of a war backdrop. "
./coco_dataset/train2017/000000434247.jpg,A group of people riding horses on top of a sandy beach.
./coco_dataset/train2017/000000033759.jpg,A little kid swinging a bat in a baseball game.
./coco_dataset/train2017/000000472298.jpg,a man and a woman sitting on a small boat
./coco_dataset/train2017/000000347265.jpg,A person skiing through a snowy forest with tall trees.
./coco_dataset/train2017/000000579635.jpg,A person riding a wave on top of a surfboard.
./coco_dataset/train2017/000000342128.jpg,The man is the sport jacket is holding a racket.
./coco_dataset/train2017/000000084270.jpg,An airport terminal with many people carrying their luggage.
./coco_dataset/train2017/000000527960.jpg,A park bench with graffiti sitting next to dead grass.
./coco_dataset/train2017/000000548524.jpg,The person is surfing through the long wave in the ocean. 
./coco_dataset/train2017/000000279927.jpg,PERFORMERS DOING A SHOW IN FRONT OF SPECTATORS
./coco_dataset/train2017/000000551660.jpg,A bowl of broccoli has green apples in it.
./coco_dataset/train2017/000000026204.jpg,Cars and a bus are stopped at an intersection.
./coco_dataset/train2017/000000511321.jpg,"Two large ferries passing by each other in a city scape,"
./coco_dataset/train2017/000000537991.jpg,A woman wearing headphones looking at some electronics.
./coco_dataset/train2017/000000520707.jpg,A cop standing next to a crowd of people.
./coco_dataset/train2017/000000163117.jpg,A large group of people in a field with kites.
./coco_dataset/train2017/000000080340.jpg,A boy in a tie holding a small suit case.
./coco_dataset/train2017/000000064462.jpg,Female skier smiling while standing in the snow. 
./coco_dataset/train2017/000000128748.jpg,Three baseball players stand communicating on a field.
./coco_dataset/train2017/000000437351.jpg,A woman in a hat sitting next to luggage.
./coco_dataset/train2017/000000065485.jpg,A dog sitting in the front seat of a truck.
./coco_dataset/train2017/000000026465.jpg,The opened  laptop is sitting on the table along with other technological tools.
./coco_dataset/train2017/000000044260.jpg,"Crisp, delicious apples hang on the dying branches of the tree."
./coco_dataset/train2017/000000367082.jpg,large dog in a brown chair by a window
./coco_dataset/train2017/000000522393.jpg,a man that is sailing on a boat in the water
./coco_dataset/train2017/000000212573.jpg,A man and a woman stand under an umbrella at a street crossing on a rainy day.
./coco_dataset/train2017/000000130465.jpg,An old gothic style building with statues adorning it and a clock.
./coco_dataset/train2017/000000333402.jpg,A man is standing outside of a bus on the curb.
./coco_dataset/train2017/000000134689.jpg,A giraffe standing in dry dead brush on the savannah.
./coco_dataset/train2017/000000384527.jpg,A living area with a number of chairs
./coco_dataset/train2017/000000166259.jpg,A group of ducks walking down the stairs
./coco_dataset/train2017/000000452321.jpg,some red and black buses are parked and a building
./coco_dataset/train2017/000000214753.jpg,THERE ARE TWO PEOPLE RIDING HORESES ON THE BEACH SHORE 
./coco_dataset/train2017/000000233033.jpg,An outdoor with a patio with chairs and a wooden deck. 
./coco_dataset/train2017/000000431545.jpg,a man that is standing next to a base
./coco_dataset/train2017/000000368752.jpg,A little boy that is sitting in front of a table.
./coco_dataset/train2017/000000285047.jpg,A person sitting at table with a cup looking at a cell phone.
./coco_dataset/train2017/000000526751.jpg,A boat is sitting in the sand near the water.
./coco_dataset/train2017/000000516601.jpg,A group of people skiing and snowboarding on the snow.
./coco_dataset/train2017/000000261706.jpg,A black and white cat laying on a couch.
./coco_dataset/train2017/000000429761.jpg,two men on a tennis court shaking hands over the net
./coco_dataset/train2017/000000449432.jpg,Young servicemen and servicewomen stand next to a blue bus with luggage.  
./coco_dataset/train2017/000000569059.jpg,"A computer is sitting on its desktop, setup on the desk with a keyboard. "
./coco_dataset/train2017/000000441247.jpg,Man and woman in the kitchen of a white house.
./coco_dataset/train2017/000000385997.jpg,A DOG QUIETLY SLEEPING IN HIS BED ENJOYING THE SUN.
./coco_dataset/train2017/000000209142.jpg,there is a large bowl with vegetables and broccoli in it
./coco_dataset/train2017/000000353518.jpg,A fleet of ships docked on a sandy beach.
./coco_dataset/train2017/000000212573.jpg,A group of two people waiting to cross the street under an umbrella.
./coco_dataset/train2017/000000184338.jpg,A truck with many painted decorations is parked in a desert.
./coco_dataset/train2017/000000438226.jpg,A sandwich cut in half is on a plate with macaroni.
./coco_dataset/train2017/000000237517.jpg,Food set out on an outdoor picnic table.
./coco_dataset/train2017/000000031817.jpg,A person on a motor scooter with a helmet on.
./coco_dataset/train2017/000000266082.jpg,An orange fire hydrant outside a modern office building
./coco_dataset/train2017/000000030828.jpg,A person covered with an orange sleeping bag rests his head on a blue back pack as he sleeps on a park bench. 
./coco_dataset/train2017/000000262487.jpg,"A hitter, catcher, and umpire near home plate during a baseball game."
./coco_dataset/train2017/000000085195.jpg,a slice of cake with some syrup next to it 
./coco_dataset/train2017/000000244496.jpg,a man with a mustache is wearing a tie
./coco_dataset/train2017/000000257084.jpg,A person standing on a skateboard on top of a ramp.
./coco_dataset/train2017/000000083540.jpg,A person on skis on snowy forest path.
./coco_dataset/train2017/000000135890.jpg,Big Ben and part of parliament from across the street.
./coco_dataset/train2017/000000263969.jpg,A bride and groom cutting a wedding cake.
./coco_dataset/train2017/000000559099.jpg,A herd of cattle stand in the field with a mountain in the background.
./coco_dataset/train2017/000000344816.jpg,A cargo train crossing under an overpass and switching tracks. 
./coco_dataset/train2017/000000418281.jpg,There white cows in grassy area with temples in background.
./coco_dataset/train2017/000000229601.jpg,there is a baseball player that has just run to the base
./coco_dataset/train2017/000000214200.jpg,People don't seem to be able to pass a Stop sign without defacing them.
./coco_dataset/train2017/000000259625.jpg,An elephant that is using it's own trunk to touch a tree trunk.
./coco_dataset/train2017/000000119995.jpg,A man serves a tennis ball during a match.
./coco_dataset/train2017/000000376310.jpg,A purple bathroom with three sinks and a purple countertop with a mirror surrounded with light bulbs.
./coco_dataset/train2017/000000447789.jpg,A Do Not Enter Sign with a Two Way Street Sign above it.
./coco_dataset/train2017/000000025057.jpg,A man without shirt on is throwing a frisbee.
./coco_dataset/train2017/000000350488.jpg,A zebra grazes on tall grass at the edge of a clear blue river.
./coco_dataset/train2017/000000110884.jpg,A green tinted bathroom consisting of a toilet and sink
./coco_dataset/train2017/000000525083.jpg,a kitchen with a wooden floor and a microwave oven 
./coco_dataset/train2017/000000451308.jpg,A tall stack of suit cases is in the hall way.
./coco_dataset/train2017/000000364166.jpg,2 Zebras standing next to each other in plaines
./coco_dataset/train2017/000000473237.jpg,A little girl eating a slice of pizza in a room.
./coco_dataset/train2017/000000277689.jpg,A fancy desert on a table with a number of drinking glasses.
./coco_dataset/train2017/000000404568.jpg,A seagull standing on the sand of a beach
./coco_dataset/train2017/000000364102.jpg,A woman throws a frisbee while at the park.
./coco_dataset/train2017/000000092939.jpg,A happy couple is cutting a decorated cake.
./coco_dataset/train2017/000000565778.jpg,Blue train car sitting on a train track near tunnel.
./coco_dataset/train2017/000000105249.jpg,White toilet and sink in white tiled walled bathroom.
./coco_dataset/train2017/000000065736.jpg,a tennis player dressed in all black returning the ball
./coco_dataset/train2017/000000311180.jpg,A hand holding a child's pair of scissors.
./coco_dataset/train2017/000000277197.jpg,The huge living room is furnished with expensive things.
./coco_dataset/train2017/000000060449.jpg,A very nice looking deck area with a small table and a laptop.
./coco_dataset/train2017/000000193429.jpg,A snow boarder sits in the snow looking at the camera. 
./coco_dataset/train2017/000000398237.jpg,Young child playing with several lawn type ornaments.
./coco_dataset/train2017/000000364297.jpg,a white and brown cat is laying on top of a keyboard
./coco_dataset/train2017/000000303653.jpg,A woman in black riding a horse by a mirror.
./coco_dataset/train2017/000000356531.jpg,A WOMAN IS SITTING AT THTE TABLE EATING FOOD 
