image,caption
./coco_dataset/train2017/000000579893.jpg,A close up of the stop sign and to street signs.
./coco_dataset/train2017/000000261097.jpg,A man in black shirt and white shorts on a tennis court.
./coco_dataset/train2017/000000429281.jpg,Display for bananas with a euro money sign
./coco_dataset/train2017/000000388215.jpg,a man reahced up his arms as he gets ready to get a hit a tennis ball
./coco_dataset/train2017/000000451879.jpg,a baseball player throwing a ball during a game
./coco_dataset/train2017/000000544519.jpg,A child holds a toothbrush halfway out of their mouth while brushing their teeth.
./coco_dataset/train2017/000000104782.jpg,A road sign on top of a stop sign at an intersection
./coco_dataset/train2017/000000275058.jpg,A person holds onto rope above water on a board.
./coco_dataset/train2017/000000272416.jpg,A small toilet on the ground with a pipe running to the camode.
./coco_dataset/train2017/000000288685.jpg,Many people watch a man and dog herd sheep.
./coco_dataset/train2017/000000060507.jpg,A batter swings at a pitch during a baseball game.
./coco_dataset/train2017/000000504711.jpg,A fork rests on a plate next to a piece of cake.
./coco_dataset/train2017/000000284282.jpg,An old blender and printer sitting on a table.
./coco_dataset/train2017/000000059386.jpg,Group of giraffes grazing from same high tree in field
./coco_dataset/train2017/000000014439.jpg,A group of people standing on a field flying a colorful kite.
./coco_dataset/train2017/000000229216.jpg,Two women sitting on ledge looking at a cellphone.
./coco_dataset/train2017/000000494634.jpg,A shadow looks like a cat in a living room.
./coco_dataset/train2017/000000061658.jpg,A white dish filled with broccoli and cauliflower.
./coco_dataset/train2017/000000434996.jpg,A small cat asleep in a pile of stuffed animals.
./coco_dataset/train2017/000000046463.jpg,A sandwich appears to have a mouth like creation.
./coco_dataset/train2017/000000351331.jpg,a small fully cooked pizza resting on plate next to a fork
./coco_dataset/train2017/000000181816.jpg,A bench that has someone in costume sitting on it.
./coco_dataset/train2017/000000226154.jpg,The large green bus drives near two people on a motorcycle.
./coco_dataset/train2017/000000226130.jpg,"A sausage on italian roll sandwich, cut in half, is on a white plate, with a garnish."
./coco_dataset/train2017/000000157756.jpg,A clock tower by street next to cars at night.
./coco_dataset/train2017/000000283412.jpg,A little poodle puppy laying near a newspaper with a look of guilt.
./coco_dataset/train2017/000000148707.jpg,Two yellow fruits hanging on branches full of leaves. 
./coco_dataset/train2017/000000527784.jpg,"A meal of sandwiches, potatoes, and Red Stripe beer."
./coco_dataset/train2017/000000159977.jpg,A giraffe and a zebra walking through an African plain.
./coco_dataset/train2017/000000570456.jpg,"A living room with seating areas, tables, and windows."
./coco_dataset/train2017/000000213445.jpg,a big cat sitting in a little bowl 
./coco_dataset/train2017/000000384666.jpg,A group of young children riding skis down a snow covered mountain.
./coco_dataset/train2017/000000018737.jpg,A motorcycle is sitting next to a beach.
./coco_dataset/train2017/000000436617.jpg,A bunch of people sitting at a table having a discussion. 
./coco_dataset/train2017/000000007281.jpg,two guys horseback riding and playing on the beach.
./coco_dataset/train2017/000000463174.jpg,A young woman in pink leggings playing tennis
./coco_dataset/train2017/000000133087.jpg,A traffic light on a open city street.
./coco_dataset/train2017/000000076211.jpg,The side of the building has a large clock and several windows.
./coco_dataset/train2017/000000428562.jpg,A sheep that is standing on some hay.
./coco_dataset/train2017/000000345261.jpg,Two giraffes standing in a wide open area.  
./coco_dataset/train2017/000000044195.jpg,Two people standing atop a snowy hill with snow boards in hand ready to head down the slope
./coco_dataset/train2017/000000327769.jpg,a cat laying in a bathroom sink while looking at the camera 
./coco_dataset/train2017/000000084270.jpg,A crowded airport filled with people carrying luggage.
./coco_dataset/train2017/000000217957.jpg,An ornate clock on the side of a building next to a tree.
./coco_dataset/train2017/000000385205.jpg,A cat holding a fake carrot while scratching on a rug.
./coco_dataset/train2017/000000006040.jpg,A large white and blue train on a train track.
./coco_dataset/train2017/000000187513.jpg,A bathroom with green walls and a toilet and a shower.
./coco_dataset/train2017/000000438862.jpg,The two teams are kicking a soccer ball.
./coco_dataset/train2017/000000112626.jpg,A wheeled suitcase sits on a wooden floor in front of a sofa.
./coco_dataset/train2017/000000335954.jpg,Two cups of fruits placed next to each other.
./coco_dataset/train2017/000000522889.jpg,Female tennis player in full run on a blue court to complete a backhand return.
./coco_dataset/train2017/000000481582.jpg,There are people standing next to a horse.
./coco_dataset/train2017/000000432898.jpg,A man is bluing a kite in an open area.
./coco_dataset/train2017/000000263299.jpg,A train rounding a corner on the tracks.
./coco_dataset/train2017/000000147725.jpg,a public transit bus on a city street 
./coco_dataset/train2017/000000450488.jpg,"A big bed sits in a living area with a ceiling fan, dresser, television set and wastepaper basket."
./coco_dataset/train2017/000000237864.jpg,an elephant and a dog on a dirt field with trees in the background
./coco_dataset/train2017/000000089880.jpg,A couple of days playing with each other on a green grass covered field.
./coco_dataset/train2017/000000480842.jpg,two giraffes and some green trees and yellow flowers
./coco_dataset/train2017/000000006460.jpg,A man riding a wave on top of a surfboard.
./coco_dataset/train2017/000000320642.jpg,A woman holding a game controller as her friend watches.
./coco_dataset/train2017/000000529939.jpg,a man holding a surfboard outside a building in a driveway
./coco_dataset/train2017/000000168458.jpg,there is a small glass vase that has purple flowers in it
./coco_dataset/train2017/000000161925.jpg,two women are cutting and preparing a pizza
./coco_dataset/train2017/000000472678.jpg,A desk with two monitors depicting security cameras.
./coco_dataset/train2017/000000001503.jpg,Two apple computers are on a white desk
./coco_dataset/train2017/000000563349.jpg,A person that is jumping in the sky on a snowboard.
./coco_dataset/train2017/000000201072.jpg,A man that is on a tennis court with a racquet.
./coco_dataset/train2017/000000403385.jpg,A view of a bathroom that needs to be fixed up.
./coco_dataset/train2017/000000193162.jpg,A black and white cow walking across a lush green field.
./coco_dataset/train2017/000000068387.jpg,Baseball players prepare for the next pitch in a game.
./coco_dataset/train2017/000000361238.jpg,A woman sitting in front of a giant pizza.
./coco_dataset/train2017/000000140076.jpg,A view of a table with a vase on the middle of it.
./coco_dataset/train2017/000000132796.jpg,People having fun riding elephants together at a park 
./coco_dataset/train2017/000000069213.jpg,Two men wearing suits and hats are walking together.
./coco_dataset/train2017/000000236308.jpg,A couple of people riding skis down a snow covered slope.
./coco_dataset/train2017/000000554579.jpg,Several women wearing distinctive clothing standing behind a dog.
./coco_dataset/train2017/000000494759.jpg,Two people fly a kite on a beach.
./coco_dataset/train2017/000000270883.jpg,A woman lays on a bed in her underwear.
./coco_dataset/train2017/000000292060.jpg,"A kitchen area with white stove, sink and a refrigerator."
./coco_dataset/train2017/000000567825.jpg,A BIG HAMBURGER SITTING ON TOP OF A COUNTER AND A GLASS OF WINE 
./coco_dataset/train2017/000000568584.jpg,A man sitting on a chair with his feet proper up .
./coco_dataset/train2017/000000187236.jpg,Couple of cats sleeping on opposite ends of the couch
./coco_dataset/train2017/000000546659.jpg,A train is coming down the tracks near a building.
./coco_dataset/train2017/000000002149.jpg,A white bowl filled with green Granny Smith apples.
./coco_dataset/train2017/000000570736.jpg,A small bathroom is featured in this photo.
./coco_dataset/train2017/000000286994.jpg,A elephant drinks from a stream with several other elephants walking in the background.
./coco_dataset/train2017/000000383386.jpg,These stuffed animals are decor on a bed
./coco_dataset/train2017/000000162366.jpg,A box where you pay for your parking.
./coco_dataset/train2017/000000044877.jpg,A woman in a wheelchair holding a tennis racquet.
./coco_dataset/train2017/000000485130.jpg,A birthday cake shaped like a wrestling ring.
./coco_dataset/train2017/000000271116.jpg,several business men in suits sitting at a table during a meeting
./coco_dataset/train2017/000000472623.jpg,A young man riding a bike on top of a beach.
./coco_dataset/train2017/000000451150.jpg,Variety of doughnuts displayed in white cardboard box.
./coco_dataset/train2017/000000312213.jpg,A cat looks away from an open computer.
./coco_dataset/train2017/000000065074.jpg,A view of a bedroom with the bed unmade.
./coco_dataset/train2017/000000518326.jpg,Three beds in a street with cartoon figures in the bed.
./coco_dataset/train2017/000000044260.jpg,An apple tree is shown in the middle of an orchard.
./coco_dataset/train2017/000000067310.jpg,A young man skateboarding jumps on a concrete ramp.
./coco_dataset/train2017/000000263796.jpg,A dirty old red toilet next to many wires.
./coco_dataset/train2017/000000397354.jpg,A group of friends hanging out in a kitchen together.
./coco_dataset/train2017/000000562059.jpg,"Two apples, a bowl of food with berries and a pitcher and spoon on a purple place mat."
./coco_dataset/train2017/000000208363.jpg,A bunch of people are sitting together eating pizza and talking.
./coco_dataset/train2017/000000532058.jpg,A little boy drinking milk from a bottle while laying in bed.
./coco_dataset/train2017/000000490470.jpg,A large body of water with three boats floating on top of it.
./coco_dataset/train2017/000000432553.jpg,A couple of dogs viewing something as a person sits in a chair.
./coco_dataset/train2017/000000166391.jpg,A number of red and green traffic lights on a wide highway.
./coco_dataset/train2017/000000284764.jpg,A gentleman wearing a radio eating a plate of food.
./coco_dataset/train2017/000000010764.jpg,a catcher kneeling at the mound waiting for a baseball 
./coco_dataset/train2017/000000140439.jpg,A. clear vase containing bouquet of pink with white tipped  tulips 
./coco_dataset/train2017/000000124442.jpg,A man holding onto a kite with one hand and spool on the other.
./coco_dataset/train2017/000000398377.jpg,There are women that are talking on the cell phone 
./coco_dataset/train2017/000000399655.jpg,Boston Terrier sitting on a couch with a shoe
./coco_dataset/train2017/000000523241.jpg,A busy street with several lanes and a crossing sign in the foreground.
./coco_dataset/train2017/000000129062.jpg,Outdoor patio and front of a bar that serves hot dogs
./coco_dataset/train2017/000000094614.jpg,A man is skiing in fresh powder past a tree.
./coco_dataset/train2017/000000024610.jpg,"A small living space with a couch, desk, chair, and bookcase."
./coco_dataset/train2017/000000125850.jpg,A cat is curled up and sleeping in a round tin.
./coco_dataset/train2017/000000477623.jpg,a close up of a train on a track with trees in the background
./coco_dataset/train2017/000000459195.jpg,The group of three friends are sitting on a fallen tree in the woods.
./coco_dataset/train2017/000000336658.jpg,"A photograph of an outside with numerous things in the scene.
"
./coco_dataset/train2017/000000015272.jpg,A traffic light hanging in front of blossoming trees.
./coco_dataset/train2017/000000151962.jpg,The reflection of a dogs head out of a car window in one of the cars wing mirrors
./coco_dataset/train2017/000000100274.jpg,a train on a train track next to a parking lot
./coco_dataset/train2017/000000312192.jpg,A white plate of food on a table.
./coco_dataset/train2017/000000377946.jpg,Yellow box truck parked on busy street in city.
./coco_dataset/train2017/000000428111.jpg,A man is performing tricks on a skateboard ramp.
./coco_dataset/train2017/000000412887.jpg,"Though not the smartest animals in the world, the cow still has a friendly face."
./coco_dataset/train2017/000000541773.jpg,A young man pouring glasses of wine in a kitchen
./coco_dataset/train2017/000000179765.jpg,A motorcycle with its brake extended standing outside
./coco_dataset/train2017/000000007816.jpg,a rider dressed in white riding a matching white motorcycle 
./coco_dataset/train2017/000000342397.jpg,a person in a colorful outfit jumping with some skiis 
./coco_dataset/train2017/000000118921.jpg,A woman on skis sliding down a snowy hill.
./coco_dataset/train2017/000000293200.jpg,A young boy flying a kite with other people.
./coco_dataset/train2017/000000261982.jpg,A person is riding on a skateboard on the street.
./coco_dataset/train2017/000000389684.jpg,Guy walking pass a bus sitting at the curb 
./coco_dataset/train2017/000000065798.jpg,"The batter stands at the plate ready to swing, as the players stand ready in the outfield."
./coco_dataset/train2017/000000479732.jpg,A stuffed sandwich is sitting on a Styrofoam container.
./coco_dataset/train2017/000000425390.jpg,a cat resting on a laptop keyboard in a bedroom
./coco_dataset/train2017/000000452084.jpg,"A lunch bowl with bread, sausage, tomato, and egg. "
./coco_dataset/train2017/000000190853.jpg,A woman's hand holding a half peeled banana with a large bite out of it
./coco_dataset/train2017/000000023272.jpg,a cat is sleeping on the hood of a car
./coco_dataset/train2017/000000010363.jpg,A gray cat standing on top of a black car.
./coco_dataset/train2017/000000216419.jpg,A clock on a pole on a sidewalk.
./coco_dataset/train2017/000000374369.jpg,a person standing snow wearing a snow suit and skis
./coco_dataset/train2017/000000186632.jpg,The large bathroom has four sinks and a chandelier.
./coco_dataset/train2017/000000117492.jpg,a group of moms and kids sitting out in a field
./coco_dataset/train2017/000000467848.jpg,A man standing behind a truck with a red trailer sitting in front of a building.
./coco_dataset/train2017/000000495732.jpg,Two men standing in a living room playing games.
./coco_dataset/train2017/000000232563.jpg,The man is walking with an umbrella near other pedestrians.
./coco_dataset/train2017/000000352900.jpg,"A plate full of noodles and broccoli, next to a knife and fork."
./coco_dataset/train2017/000000482970.jpg,A laptop computer sitting on a desk with a speaker.
./coco_dataset/train2017/000000314294.jpg,An elephant is alone in a wooded enclosure.
./coco_dataset/train2017/000000165039.jpg,Bus coming down the street from the intersection
./coco_dataset/train2017/000000416837.jpg,A cow is standing on a grassy sloped hill.
./coco_dataset/train2017/000000056545.jpg,A gray bird is standing on small brown branch.
./coco_dataset/train2017/000000372317.jpg,The tour bus is parked beside the curb of a building.
./coco_dataset/train2017/000000032901.jpg,A group of older man standing next to each other.
./coco_dataset/train2017/000000535578.jpg,A group of sheep grazing in a grassy valley.
./coco_dataset/train2017/000000016249.jpg,It sure is a beautiful day to sit outside and read the paper.
./coco_dataset/train2017/000000418961.jpg,A decorative clock has roman numerals on its face.
./coco_dataset/train2017/000000462904.jpg,A large horse standing inside of a wooden pen.
./coco_dataset/train2017/000000528977.jpg,Various street signs and a building next to a bridge.
./coco_dataset/train2017/000000193926.jpg,The various pictures are featuring bananas and holders.
./coco_dataset/train2017/000000211674.jpg,a double decker bus with people waving from the top
./coco_dataset/train2017/000000540466.jpg,A person standing with umbrella in front of wall.
./coco_dataset/train2017/000000257865.jpg,A man holding a tennis racket picks rubs his eye.
./coco_dataset/train2017/000000297085.jpg,a cat is standing in front of a television
./coco_dataset/train2017/000000360393.jpg,A pizza that is sitting on a table.
./coco_dataset/train2017/000000525247.jpg,A cat is looking at a laptop screen.
./coco_dataset/train2017/000000430056.jpg,Large Bacon Lettuce and Tomato Sandwich with a side of chips.
./coco_dataset/train2017/000000377113.jpg,A person on some skis in the water.
./coco_dataset/train2017/000000366711.jpg,This is a man working behind the counter of a bar with a lot of oranges and lemons.
./coco_dataset/train2017/000000500464.jpg,A sink in a bathroom is shown with other items.
./coco_dataset/train2017/000000167353.jpg,An old wooden  clock attached to the wall
./coco_dataset/train2017/000000116439.jpg,A person in a boat rowing away from shore.
./coco_dataset/train2017/000000076731.jpg,A pen is sitting on top of a laptop.
./coco_dataset/train2017/000000451090.jpg,"a landscape with water, a boat, trees and mountains"
./coco_dataset/train2017/000000013546.jpg,A young man riding a skateboard on a stone wall.
./coco_dataset/train2017/000000552775.jpg,A man pokes his head in front of an oven open to baking cookies.
./coco_dataset/train2017/000000368900.jpg,a room with a television set  a stool and some pictures
./coco_dataset/train2017/000000433192.jpg,A laptop computer is sitting open on a bed. 
./coco_dataset/train2017/000000218249.jpg,a burger and some fries on a tray
./coco_dataset/train2017/000000131379.jpg,The browned cracked crust of a baked berry pie.
./coco_dataset/train2017/000000512648.jpg,a brown cow is standing under a green tree
./coco_dataset/train2017/000000344795.jpg,The oven contains a dish that is covered with tin foil.
./coco_dataset/train2017/000000520910.jpg,A person and a toilet standing in a room.
./coco_dataset/train2017/000000150930.jpg,A clock protruding from the side of a building.  
./coco_dataset/train2017/000000469192.jpg,A car is parked on dry grass with kites overhead.
./coco_dataset/train2017/000000007281.jpg,Two men are riding horses along the beach.
./coco_dataset/train2017/000000077460.jpg,People fill a park area under a cloudy sky while kites pepper the sky.
./coco_dataset/train2017/000000523175.jpg,A spoon resting on the edge of a bowl of soup.
./coco_dataset/train2017/000000153529.jpg,a woman with her luggage at a train station
./coco_dataset/train2017/000000187055.jpg,A girl dressed in black holds up a tennis racket as a man in a white t-shirt stands in front of her.
./coco_dataset/train2017/000000233727.jpg,A bus drives on a paved road with markings.
./coco_dataset/train2017/000000043581.jpg,A small pizza sitting on a blue table.
./coco_dataset/train2017/000000301061.jpg,A man pulls an elephant out of a truck.
./coco_dataset/train2017/000000344795.jpg,A casserole covered in foil is inside an oven.
./coco_dataset/train2017/000000013291.jpg,A group of people in a field smile holding frisbees.
./coco_dataset/train2017/000000213086.jpg,There is a man opening the oven door.
./coco_dataset/train2017/000000131273.jpg,A dog looks interested as he sits in the front seat of a car.
./coco_dataset/train2017/000000452321.jpg,A red bus parked at a bus stop in front of a building.
./coco_dataset/train2017/000000370818.jpg,a cabinet towels a toilet and a sink
./coco_dataset/train2017/000000503841.jpg,two street lights that are both on the green light
./coco_dataset/train2017/000000315187.jpg,A bus parked in front of a building.
./coco_dataset/train2017/000000343453.jpg,a woman wearing skis on a snowy mountain posing for the camera. 
./coco_dataset/train2017/000000281414.jpg,A girl is sitting on a brick wall using her cell phone.
./coco_dataset/train2017/000000362682.jpg,A Japanese community bus with a cartoon dog on the side
./coco_dataset/train2017/000000183709.jpg,Four people wait to cross the street at an intersection.
./coco_dataset/train2017/000000545100.jpg,A man taking a picture of the city with his cellphone.
./coco_dataset/train2017/000000088218.jpg,"a pole with street lights, signs and wires attached to it "
./coco_dataset/train2017/000000512836.jpg,A person with an umbrella and two dogs walking in the snow.
./coco_dataset/train2017/000000017182.jpg,A desk in a classroom with a blackboard behind it
./coco_dataset/train2017/000000550797.jpg,"A little powder room with a blue toilet, multicolored tile floor, and a colorful towel."
./coco_dataset/train2017/000000053505.jpg,There are a variety of bottles and two towels over the toilet.
./coco_dataset/train2017/000000261535.jpg,A woman who is holding a tennis racket and scratching her butt.
./coco_dataset/train2017/000000551304.jpg,A photograph of a very decorated toilet in a bathroom.
./coco_dataset/train2017/000000169356.jpg,A young man performs a trick on a skate board.
./coco_dataset/train2017/000000366225.jpg,a big apple monitor that is on a desk
./coco_dataset/train2017/000000030785.jpg,Plate containing bread covered in some type of spread and cooked broccoli
./coco_dataset/train2017/000000240250.jpg,A woman sitting down at a table with pizza.
./coco_dataset/train2017/000000099053.jpg,"A bowl of noodles, meat, broccoli and carrots in a sauce with a fork."
./coco_dataset/train2017/000000018837.jpg,A large truck on a city street with two works sitting on top and one worker climbing in through door.
./coco_dataset/train2017/000000261061.jpg,A young lady throwing a blue frisbee while standing on a lush green field.
./coco_dataset/train2017/000000398237.jpg,A baby is holding some poles in the middle of a grass field. 
./coco_dataset/train2017/000000308587.jpg,"The photo shows the many ways to enjoy the beach--kite flying, bathing, lying in the sun, walking along the sand."
./coco_dataset/train2017/000000464144.jpg,A skier is skiing in the winter snow outdoors.
./coco_dataset/train2017/000000418281.jpg,The white scared cow in a Tibetan city.
./coco_dataset/train2017/000000515350.jpg,A surfer riding the inside of the curve of a wave.
./coco_dataset/train2017/000000261888.jpg,A bike with horses in background of the rider
./coco_dataset/train2017/000000006012.jpg,Six bananas and a red fruit make an artistic sight paired with a blue background.
./coco_dataset/train2017/000000349594.jpg,A young boy holding a doughnut with a bite out of it.
./coco_dataset/train2017/000000001268.jpg,A waterway under a bridge with people sitting down and a woman taking a photo.
./coco_dataset/train2017/000000227686.jpg,Horse with blinders on walking through wooded area
./coco_dataset/train2017/000000210855.jpg,"A view of a bathroom that appears to be very elegant. 
"
./coco_dataset/train2017/000000229553.jpg,A guy squatting on a skateboard trying to balance.
./coco_dataset/train2017/000000371699.jpg,A room full of shelving and many supplies
./coco_dataset/train2017/000000254016.jpg,A fryer has rows and rows of doughnuts on an assembly line.
./coco_dataset/train2017/000000481567.jpg,A man standing by a motor cycle on a street.
./coco_dataset/train2017/000000568690.jpg,A small cat sits on top of a white toilet missing its seat in a bathroom.
./coco_dataset/train2017/000000460683.jpg,A man is wearing a tie with many words on it
./coco_dataset/train2017/000000183391.jpg,A man holding a tennis racquet on top of a tennis court.
./coco_dataset/train2017/000000350054.jpg,One cat sitting in front of the television screen.
./coco_dataset/train2017/000000155179.jpg,A dense cake with fruit in it sitting on a blue plate.
./coco_dataset/train2017/000000575187.jpg,A giraffe sticks his nose and tongue out of a wire fence to accept something a man is offering him.
./coco_dataset/train2017/000000042888.jpg,Forested area in city with a sign with cartoon character nearby.
./coco_dataset/train2017/000000100428.jpg,A man pulling himself out of a mirror by his own tie.
./coco_dataset/train2017/000000329827.jpg,A person skiing on a mountain covered with snow
./coco_dataset/train2017/000000509008.jpg,A bus is painted half pink and half yellow.
./coco_dataset/train2017/000000203095.jpg,a bunch of food is layed out next to an oven
./coco_dataset/train2017/000000436617.jpg,a group of people sitting at a long dining table in a restaurant
./coco_dataset/train2017/000000030828.jpg,A person is sleeping on a bench in a sleeping bag.
./coco_dataset/train2017/000000026690.jpg,A man is high in the air as he skateboards on the ramp.
./coco_dataset/train2017/000000516916.jpg,"A table with laptops, monitor screens, keyboards, mice, phone handsets and    chairs"
./coco_dataset/train2017/000000428218.jpg,a man and a woman are playing outside.
./coco_dataset/train2017/000000193181.jpg,a man holding up a baseball bat as he gets ready to hit a ball
./coco_dataset/train2017/000000138550.jpg,Orange fire hydrant on the sidewalk in a commercial area
./coco_dataset/train2017/000000000802.jpg,The refrigerator is brand new and was delivered today.
./coco_dataset/train2017/000000427077.jpg,A vintage black and white portrait of a baseball player.
./coco_dataset/train2017/000000541291.jpg,An old very dirty bathroom with soap dispensers mounted to a tiled wall.
./coco_dataset/train2017/000000047112.jpg,A dining table has a large pizza and wine glasses.
./coco_dataset/train2017/000000018519.jpg,A young man riding a skateboard down the side of a ramp.
./coco_dataset/train2017/000000213547.jpg,A woman is sitting on a kid's horse ride at a store holding a cake with candles.
./coco_dataset/train2017/000000334521.jpg,Giraffes and a bird behind a chain link fence at a zoo
./coco_dataset/train2017/000000152214.jpg,a smiling man wearing a suit and tie in front of a colorful wall
./coco_dataset/train2017/000000398742.jpg,The team mates are lifting up one of their members.
./coco_dataset/train2017/000000125257.jpg,A snow boarder is going down the slope on his board.
