image,caption
./coco_dataset/train2017/000000273642.jpg,A dog is laying down with the remote control.
./coco_dataset/train2017/000000322844.jpg,there are two stuffed animals on a wooden bench
./coco_dataset/train2017/000000222455.jpg,A vending machine for microwaved food with a microwave at the bottom.
./coco_dataset/train2017/000000447917.jpg,A group of young girls playing a game of soccer.
./coco_dataset/train2017/000000352491.jpg,A passenger train on the outer track at a railway station.
./coco_dataset/train2017/000000303818.jpg,A group of people cross the curved street.
./coco_dataset/train2017/000000312720.jpg,A person on skis flies through the air on a rope.
./coco_dataset/train2017/000000226984.jpg,A kitchen with an oven with a green rag and an orange rag.
./coco_dataset/train2017/000000080274.jpg,A large elephant standing next to a smaller elephant.
./coco_dataset/train2017/000000227044.jpg,A cat idly looks by on top of a sink
./coco_dataset/train2017/000000052591.jpg,A woman standing while holding a pole on snow
./coco_dataset/train2017/000000273712.jpg,Large black two door refrigerator in an apartment under renovation.
./coco_dataset/train2017/000000447313.jpg,Pack of three zebras eating grass near a log.
./coco_dataset/train2017/000000570448.jpg,A man sanding on a boat next to a beach.
./coco_dataset/train2017/000000563281.jpg,A little boy in pajamas playing with his toys.
./coco_dataset/train2017/000000298904.jpg,There is a vase filled with water that has rocks and a plant in it
./coco_dataset/train2017/000000565607.jpg,A green fire hydrant next to field of colorful flowers.
./coco_dataset/train2017/000000502737.jpg,A person holds an oddly shaped cookie in front of the camera.
./coco_dataset/train2017/000000125778.jpg,A living room with a white carpet and black furniture.
./coco_dataset/train2017/000000569565.jpg,some construction stucks pared on the side of the road
./coco_dataset/train2017/000000005193.jpg,A group of people pose for a picture while a man holds two surfboards. 
./coco_dataset/train2017/000000155145.jpg,a blue boat is sitting in the water
./coco_dataset/train2017/000000292456.jpg,A man and woman on a scooter receiving baggage from a bellhop.
./coco_dataset/train2017/000000289417.jpg,A small boy skiing down a snowy hill
./coco_dataset/train2017/000000117425.jpg,A child holds a spoon and looks at a cupcake.
./coco_dataset/train2017/000000334006.jpg,Garbage truck parked in back alley of large office building.
./coco_dataset/train2017/000000206218.jpg,A laptop computer sitting on a truck table.
./coco_dataset/train2017/000000370270.jpg,A woman with a stick hitting something red and blurry in the air indoors.
./coco_dataset/train2017/000000125472.jpg,A skateboarder jumps while trying to perform a trick.
./coco_dataset/train2017/000000287649.jpg,A colorful cat is next to a keyoard
./coco_dataset/train2017/000000108495.jpg,A girl in an orange sweater is sitting on a skateboard.
./coco_dataset/train2017/000000173383.jpg,A white boxy birthday cake with red flowers and blue accents on a decorated table with gray cover and candles.
./coco_dataset/train2017/000000555012.jpg,a white toilet and tub in a bathroom
./coco_dataset/train2017/000000323828.jpg,"Train with lights on, multiple track area, near over/under pass."
./coco_dataset/train2017/000000469828.jpg,A skier races downhill on a ski track.
./coco_dataset/train2017/000000302990.jpg,A man riding a surfboard across a wave in an ocean.
./coco_dataset/train2017/000000142324.jpg,Busy street scene in India including various modes of transportation.
./coco_dataset/train2017/000000305695.jpg,A bunch of zebras grazing near a road where vehicles are driving by.
./coco_dataset/train2017/000000007795.jpg,A hotel room with two beds side by side  .
./coco_dataset/train2017/000000235399.jpg,a moving truck with a dog sitting in the back
./coco_dataset/train2017/000000209142.jpg,"a bowl of peas, broccoli and carrots with utensils"
./coco_dataset/train2017/000000102644.jpg,There is a bathroom with tile floors and tile walls.
./coco_dataset/train2017/000000338532.jpg,A small giraffe standing on sand in its zoo enclosure
./coco_dataset/train2017/000000017959.jpg,many large kites flying in the sky 
./coco_dataset/train2017/000000395575.jpg,a bench sits between a pond and the tree line
./coco_dataset/train2017/000000130566.jpg,A train pulls a large number of cars through a junction.
./coco_dataset/train2017/000000127624.jpg,View of a highway near a city at sunset
./coco_dataset/train2017/000000290843.jpg,A person sitting on bed behind an open laptop computer and a cat sitting beside and looking at the laptop screen area.
./coco_dataset/train2017/000000042563.jpg,"A yellow bus travels through a snowy, tree lined street."
./coco_dataset/train2017/000000286182.jpg,A man sitting by a table with food in bowls and pans 
./coco_dataset/train2017/000000065485.jpg,A dog is sitting inside a red car.
./coco_dataset/train2017/000000252776.jpg,A tennis player anticipating the ball on the court.
./coco_dataset/train2017/000000177935.jpg,A large white kitchen range with gold towels on the front.
./coco_dataset/train2017/000000115870.jpg,Some people hanging around in a living room with a big couch.
./coco_dataset/train2017/000000501368.jpg,A person wearing a towel is drying their hair with a hair dryer.
./coco_dataset/train2017/000000371677.jpg,A couple of computer monitors sitting on top of a wooden desk.
./coco_dataset/train2017/000000197004.jpg,The busuit has a piece of meat in it
./coco_dataset/train2017/000000284725.jpg,A bus in China is parked along a curb. 
./coco_dataset/train2017/000000417876.jpg,Two giraffes are standing together outside near a wall.
./coco_dataset/train2017/000000031817.jpg,A man on a motor scooter waiting in a group of motor scooters.
./coco_dataset/train2017/000000460229.jpg,There is a truck behind the stop sign. 
./coco_dataset/train2017/000000328601.jpg,A male tennis player in action on the court.
./coco_dataset/train2017/000000482719.jpg,Plums and bananas are in a glass bowl. 
./coco_dataset/train2017/000000561465.jpg,The table has meat and donuts sitting on it.
./coco_dataset/train2017/000000548555.jpg,There is a chili dog in the bun.
./coco_dataset/train2017/000000322574.jpg,French fries and a bag with bread sticking out 
./coco_dataset/train2017/000000328030.jpg,the teddy bear is holding a hockey stick 
./coco_dataset/train2017/000000361238.jpg,A pizza with a slice missing is sitting on a pizza stand.
./coco_dataset/train2017/000000540928.jpg,"There is a room with distinctive things in the picture. 
"
./coco_dataset/train2017/000000398438.jpg,A person cutting a multi layer cake with a knife.
./coco_dataset/train2017/000000434204.jpg,A man riding on a skateboard on the sidewalk.
./coco_dataset/train2017/000000177015.jpg,An Apple user and his faithful cat surf the web.
./coco_dataset/train2017/000000211042.jpg,A cat is propped up on the toilet seat.
./coco_dataset/train2017/000000191013.jpg,Vehicles riding in front of building with a huge clock on it.
./coco_dataset/train2017/000000287874.jpg,A train pulling up to an out door train depot.
./coco_dataset/train2017/000000156292.jpg,A woman standing in front of an outdoor wall decorated with images and clocks.
./coco_dataset/train2017/000000057760.jpg,many people on a beach with a kite flying in the sky
./coco_dataset/train2017/000000059386.jpg,A group of giraffes that are standing in the grass.
./coco_dataset/train2017/000000172648.jpg,a man reaches in the back of a truck 
./coco_dataset/train2017/000000297595.jpg,A person in a black wetsuit surfing on a wave alone
./coco_dataset/train2017/000000131138.jpg,Large office desk with computers near a window.
./coco_dataset/train2017/000000069138.jpg,A street scene with a close of of a stop light.
./coco_dataset/train2017/000000542856.jpg,A large white bus on a city street.
./coco_dataset/train2017/000000000885.jpg,A man holding a tennis racket playing tennis.
./coco_dataset/train2017/000000209972.jpg,A sail boat sitting on the sand at the beach
./coco_dataset/train2017/000000263474.jpg,An ordinary bathroom with a toilet and trash bin.
./coco_dataset/train2017/000000357567.jpg,A small bathroom with a white toilet next to a shower curtain covered bath tub.
./coco_dataset/train2017/000000032861.jpg,A man standing in a hallway with an umbrella and rain coming down.
./coco_dataset/train2017/000000115245.jpg,A table topped with bags of luggage and purses.
./coco_dataset/train2017/000000499031.jpg,The three women are posing for pictures. 
./coco_dataset/train2017/000000439525.jpg,A man and a woman cutting up a small white cake.
./coco_dataset/train2017/000000039769.jpg,Two cats sleeping with a remote control near each of them.
./coco_dataset/train2017/000000004134.jpg,Two men standing next to each other holding hands.
./coco_dataset/train2017/000000002592.jpg,a close up of a knife and a cup on a surface
./coco_dataset/train2017/000000200162.jpg,A yellow and red train is on the tracks.
./coco_dataset/train2017/000000404601.jpg,A yellow and black sign for a restaurant and lounge with red arrow pointing downwards.
./coco_dataset/train2017/000000177539.jpg,A man in striped shorts leaning against a board on a beach. 
./coco_dataset/train2017/000000511999.jpg,Two men in orange vests are next to a train.
./coco_dataset/train2017/000000344268.jpg,A president standing at the microphone by a big flag.
./coco_dataset/train2017/000000400815.jpg,A man sitting in the back of a truck.
./coco_dataset/train2017/000000230983.jpg,a man wearing a hat does a trick on  a skateboard
./coco_dataset/train2017/000000076211.jpg,An old and somewhat rundown building with a clock above the door.
./coco_dataset/train2017/000000515350.jpg,A surfer kneels as he catches a large wave. 
./coco_dataset/train2017/000000267903.jpg,A filthy bathroom has a dirt covered sink and a rusty toilet.
./coco_dataset/train2017/000000353027.jpg,A person grabbing a slice of pizza with cheese and mushrooms.
./coco_dataset/train2017/000000100283.jpg,A stop sign with an Arabic translation on it.
./coco_dataset/train2017/000000302107.jpg,A baseball player in mid swing hitting a ball.
./coco_dataset/train2017/000000107339.jpg,Two children in a room with tables and couches.
./coco_dataset/train2017/000000343706.jpg,A woman holding her cell phone tucked in a wool cover.
./coco_dataset/train2017/000000404249.jpg,Boy riding a skateboard down a road or paved sidewalk 
./coco_dataset/train2017/000000560312.jpg,An indoor station has a television on the wall.
./coco_dataset/train2017/000000340697.jpg,Several bottles are displayed in a commercial refrigerator.
./coco_dataset/train2017/000000179898.jpg,A little kid holding up two hot dogs in buns.
./coco_dataset/train2017/000000144984.jpg,A boy wearing an orange t-shirt playing a video game while sitting on a couch.
./coco_dataset/train2017/000000233727.jpg,A bus coming around the corner on a city street.
./coco_dataset/train2017/000000012576.jpg,A woman sitting at a table topped with pizza.
./coco_dataset/train2017/000000354753.jpg,Oncoming traffic shining their lights at a traffic stop. 
./coco_dataset/train2017/000000398203.jpg,A bunch of little kids playing soccer with each other. 
./coco_dataset/train2017/000000218997.jpg,A sitting child and several adults outside of a batting cage.
./coco_dataset/train2017/000000340894.jpg,Two computers are sitting on top of the desk.
./coco_dataset/train2017/000000502229.jpg,A city scape scene with a train yard in the foreground.
./coco_dataset/train2017/000000251537.jpg,There is a carrot next to some greens on the red cutting board.
./coco_dataset/train2017/000000162130.jpg,A park bench placed near an open field
./coco_dataset/train2017/000000357941.jpg,A black and white cat sits on a red cloth that is over a television set.
./coco_dataset/train2017/000000042628.jpg,The snow is almost covering the fire hydrant.
./coco_dataset/train2017/000000125806.jpg,one black cow sniffing another black cows head
./coco_dataset/train2017/000000359135.jpg,a close up of some elephants with tusks
./coco_dataset/train2017/000000252701.jpg,A boy riding waves on his surf board in the ocean. 
./coco_dataset/train2017/000000099114.jpg,People standing and walking at a city intersection
./coco_dataset/train2017/000000082821.jpg,Group of paddle boats tied up alongside a pear on the water. 
./coco_dataset/train2017/000000512476.jpg,a double sink with a bowl of food on the sink counter top
./coco_dataset/train2017/000000498032.jpg,A woman plays a video game with a controller.
./coco_dataset/train2017/000000489764.jpg,A woman and a man playing a video game in the living room
./coco_dataset/train2017/000000319534.jpg,A man wearing a t-shirt stands in the door way of a white bus.
./coco_dataset/train2017/000000484296.jpg,A bunch of zebras in a park somewhere.
./coco_dataset/train2017/000000372718.jpg,A vase with some water and dead flowers in it.
./coco_dataset/train2017/000000547519.jpg,A bear is running around in a dirt field
./coco_dataset/train2017/000000516318.jpg,A surfer is riding a wave in the ocean.
./coco_dataset/train2017/000000478721.jpg,Two people that are carrying a clear box kite. 
./coco_dataset/train2017/000000028285.jpg,A white clock tower at the top of a tiled building.
./coco_dataset/train2017/000000554838.jpg,a white refrigerator with some cereal on top
./coco_dataset/train2017/000000219440.jpg,Here is a image of an zoo animals.
./coco_dataset/train2017/000000377635.jpg,A guy on a skate board high in the air.
./coco_dataset/train2017/000000177357.jpg,a man riding on top of a wave with a surfboard
./coco_dataset/train2017/000000577959.jpg,A person flying a kite on wet sand.
./coco_dataset/train2017/000000537991.jpg,a woman in a blue top with headphones and two cellphones
./coco_dataset/train2017/000000140420.jpg,A motorcycle is parked on a gravel road in a forest by a stream.
./coco_dataset/train2017/000000017115.jpg,A rear view of two zebras with their heads up against a fence.
./coco_dataset/train2017/000000182202.jpg,A cellphone next to a laptop computer. 
./coco_dataset/train2017/000000200839.jpg,An educational bus is parked in a residential area.
./coco_dataset/train2017/000000234607.jpg,"A man and a woman playing a game
"
./coco_dataset/train2017/000000325031.jpg,"A sculpture of an elephant, decorated with images of other animals."
./coco_dataset/train2017/000000007795.jpg,a large modern hotel room with double beds
./coco_dataset/train2017/000000034452.jpg,Man standing in wooded area playing with flying discs.
./coco_dataset/train2017/000000172877.jpg,A man dressed with a tie sits in a chair. 
./coco_dataset/train2017/000000025986.jpg,"Food is on the counter including a glass of water, rice, vegetables, and more"
./coco_dataset/train2017/000000003156.jpg,A man attempting to lift up a toilet off the floor.
./coco_dataset/train2017/000000231097.jpg,"Broccoli, carrots and a small amount of potatoes on a plate."
./coco_dataset/train2017/000000070048.jpg,a table that has some food on top of it
./coco_dataset/train2017/000000302107.jpg,Two athletes actively playing a game of baseball.
./coco_dataset/train2017/000000342397.jpg,a young man wearing skis slides down the slope
./coco_dataset/train2017/000000383337.jpg,A person reaching into an open box of doughnuts
./coco_dataset/train2017/000000229849.jpg,A tennis player jumping up in the air with her tennis racket.
./coco_dataset/train2017/000000369771.jpg,Two plastic containers sitting on top of a wooden table.
./coco_dataset/train2017/000000279774.jpg,a small baseball little league player is at bat
./coco_dataset/train2017/000000308193.jpg,A building with a clock built into it. 
./coco_dataset/train2017/000000409268.jpg,a poor little teddy bear smashed and covered with dirt
./coco_dataset/train2017/000000370478.jpg,Two pieces of luggage sitting near a dresser and laptop.
./coco_dataset/train2017/000000492878.jpg,A bathroom sink and its reflection in the mirror.
./coco_dataset/train2017/000000322895.jpg,"A room with a couch, chairs, television and a table. "
./coco_dataset/train2017/000000186980.jpg,A very pretty kitchen with a small wooden dining table.
./coco_dataset/train2017/000000419379.jpg,There are donuts arranged on a silver plate 
./coco_dataset/train2017/000000125806.jpg,Two black cows facing each other with woods behind them.
./coco_dataset/train2017/000000309495.jpg,A blurry photo of a toilet seat in a bathroom.
./coco_dataset/train2017/000000348243.jpg,A chubby black pony in a pasture looking ahead.
./coco_dataset/train2017/000000040471.jpg,a white kitchen with a ceiling fan a stove and refrigerator
./coco_dataset/train2017/000000276720.jpg,A stone building with a blue door on it
./coco_dataset/train2017/000000307145.jpg,A KITCHEN WITH A SINK AND TABLE IN IT 
./coco_dataset/train2017/000000466602.jpg,A snow skier is standing on the snow.
./coco_dataset/train2017/000000200252.jpg,Two green shoes lined up on a bed.
./coco_dataset/train2017/000000468233.jpg,A chrome colored wrist watch laying near other items.
./coco_dataset/train2017/000000221708.jpg,A wood paneled kitchen with dining table and tiled floor.
./coco_dataset/train2017/000000082807.jpg,There is a dog that is seated at the table with a frosted cup cake in front of the dog
./coco_dataset/train2017/000000137576.jpg,A dairy cow sticking its tongue out from inside its stall.
./coco_dataset/train2017/000000199055.jpg,A man wearing sunglasses getting ready to ride a skate board.
./coco_dataset/train2017/000000527215.jpg,A man flying a kite while standing on a beach.
./coco_dataset/train2017/000000268996.jpg,A city street sign mounted on a black pole near a high rise building.
./coco_dataset/train2017/000000027932.jpg,A catchers mitt sitting inside of a blue baseball hat.
./coco_dataset/train2017/000000408120.jpg,A small girl is holding an umbrella over her head
./coco_dataset/train2017/000000060932.jpg,A group of people standing in a room.
./coco_dataset/train2017/000000456292.jpg,Cat going inside house through small opening on door. 
./coco_dataset/train2017/000000167540.jpg,A small engine plane flying over in the blue sky.
./coco_dataset/train2017/000000239041.jpg,A bathroom with the reflection of a tv in a mirror
./coco_dataset/train2017/000000089761.jpg,A toilet seat sits in front of a tree.
./coco_dataset/train2017/000000257169.jpg,a woman holds a dryer in a bathroom 
./coco_dataset/train2017/000000180383.jpg,A TV mounted in a cow on a wall.
./coco_dataset/train2017/000000098716.jpg,A man sitting on a bench with a view of the ocean behind him.
./coco_dataset/train2017/000000068833.jpg,The decor in this house is out of date.
./coco_dataset/train2017/000000369812.jpg,A city street with cars and street signs giving directions
./coco_dataset/train2017/000000522156.jpg,a close up of a plate with food 
./coco_dataset/train2017/000000058111.jpg,A cat sleeping on a table with its paw extended out.
./coco_dataset/train2017/000000188439.jpg,A small white truck on the road next to trees.
./coco_dataset/train2017/000000423519.jpg,A city bus drives down a quiet road.
./coco_dataset/train2017/000000068093.jpg,An older couple with helmets preparing to go on a motorcycle ride.
./coco_dataset/train2017/000000253819.jpg,A male skateboarder that an ollie off the curb of a snowy street.
./coco_dataset/train2017/000000435299.jpg,An orange cat playing on the bed sheets.
./coco_dataset/train2017/000000562561.jpg,A small dog is looking at a larger barking dog.
./coco_dataset/train2017/000000456015.jpg,The group of friends is riding down the beach.
./coco_dataset/train2017/000000095707.jpg,A table topped with a train styled cake.
./coco_dataset/train2017/000000047571.jpg,"A pair of people ride a small, horse drawn buggy near a large puddle of water."
./coco_dataset/train2017/000000074733.jpg,two flatbread pieces covered with different ingredients in between a flight of beers
./coco_dataset/train2017/000000178028.jpg,A bathroom vanity sink with a large mirror and hairdryer on the wall.
./coco_dataset/train2017/000000108244.jpg,A black cat with a hat on the ground.
./coco_dataset/train2017/000000094751.jpg,A parking lot is on the side of the ocean.
./coco_dataset/train2017/000000384616.jpg,A red fire hydrant sitting on the side of a dirt road.
./coco_dataset/train2017/000000473121.jpg,a person skiing on a snow covered snow bank.
./coco_dataset/train2017/000000379332.jpg,A tennis player is looking up to the sky.
./coco_dataset/train2017/000000052017.jpg,I am unable to see an image above.
./coco_dataset/train2017/000000034205.jpg,Chicken and mushrooms served with broccoli garnished with parsley.
./coco_dataset/train2017/000000301867.jpg,Three girls walking down the sidewalk under a sun umbrella.
./coco_dataset/train2017/000000290771.jpg,A large glass window in a living room.
./coco_dataset/train2017/000000425702.jpg,A surfer walking on a beach holding a surfboard.
./coco_dataset/train2017/000000270066.jpg,A motorcycle is parked near a puddle and a van.
./coco_dataset/train2017/000000516677.jpg,People standing and sitting on snow with skis and mountain
./coco_dataset/train2017/000000182805.jpg,A woman and a dog sitting on the ground.
./coco_dataset/train2017/000000116068.jpg,A man looks at the kite he's holding while another man and woman look off camera in the same direction.
./coco_dataset/train2017/000000179653.jpg,A large metal clock on a pole outside.
./coco_dataset/train2017/000000459272.jpg,A woman holding a cell phone and standing in a littered field with others.
./coco_dataset/train2017/000000136715.jpg,A police officer on a motorcycle drives through a parade.
./coco_dataset/train2017/000000019402.jpg,A COUPLE WEARING HEAVY COATS LAUGHING WHILE EATING PIZZA.
./coco_dataset/train2017/000000137950.jpg,An old photo of a small plane in the air.
./coco_dataset/train2017/000000547144.jpg,There are two desktop computer and one laptop on the desk.
./coco_dataset/train2017/000000133631.jpg,An elephant standing inside of a dirt pen.
./coco_dataset/train2017/000000050896.jpg,a big bowl of oranges that is on the floor
./coco_dataset/train2017/000000580410.jpg,A living room with a white sofa and a gray rug.
./coco_dataset/train2017/000000218439.jpg,Man brushing his teeth and looking at his phone.
./coco_dataset/train2017/000000269942.jpg,Vehicles on a street near a green traffic light.
./coco_dataset/train2017/000000549390.jpg,a person in a dress rides on a bike 
./coco_dataset/train2017/000000298994.jpg,A bunch pf different vegetables is on a crate next to a CSA pamphlet.
./coco_dataset/train2017/000000500613.jpg,A fire truck sitting in the stations park lot.
./coco_dataset/train2017/000000567011.jpg,A person in a wetsuit riding a wave on a surfboard.
./coco_dataset/train2017/000000537672.jpg,A large black refrigerator with various bits of paper stuck to it with magnets.
./coco_dataset/train2017/000000456292.jpg,A dirty floor and wall with a black kit going into a trap door.
./coco_dataset/train2017/000000273551.jpg,Several motorcycles that are parked on the side of the street.
./coco_dataset/train2017/000000533958.jpg,A plate with an assortment of food including an egg and salad
./coco_dataset/train2017/000000244019.jpg,A fire hydrant painted red white and blue
./coco_dataset/train2017/000000248631.jpg,"A laptop computer with an attached trackball device, showing the Windows logo on the screen."
./coco_dataset/train2017/000000236845.jpg,there is a street sign that has been written on
./coco_dataset/train2017/000000382111.jpg,a teenager on a horse at a gas station.
./coco_dataset/train2017/000000010995.jpg,The neatly made bed is beside an open window.
./coco_dataset/train2017/000000086755.jpg,THERE ARE PEOPLE THAT ARE ON THE SNOW SLOPE SKIING
./coco_dataset/train2017/000000082085.jpg,A gentleman is waving a flag at people passing by in a train.
./coco_dataset/train2017/000000044590.jpg,A large group of motorcyclists have parked on the side of a road.
./coco_dataset/train2017/000000361586.jpg,Some people are checking in at the ticket counter somewhere in Asia.
./coco_dataset/train2017/000000047769.jpg,"The small room has a couch, a television, and a table with two stools."
./coco_dataset/train2017/000000038048.jpg,A red fire hydrant is on the sidewalk next to a sign.
./coco_dataset/train2017/000000019221.jpg,A person holding a piece of broccoli with an insect on it. 
./coco_dataset/train2017/000000015956.jpg,A woman and a horse in a barn with dirt floor.
./coco_dataset/train2017/000000438862.jpg,Soccer players in orange and grey uniforms on a field. 
./coco_dataset/train2017/000000385719.jpg,An office desk with two computer monitors and one laptop.
./coco_dataset/train2017/000000122962.jpg,A group of young children sitting around a long table.
./coco_dataset/train2017/000000361180.jpg,A brown bear is standing on the rocks facing forward.
./coco_dataset/train2017/000000283785.jpg,A man reads a story to a group of children.  
./coco_dataset/train2017/000000211674.jpg,Red double decker bus with people standing on top.
./coco_dataset/train2017/000000172648.jpg,a man leaning over the back of a truck in front of buildings
./coco_dataset/train2017/000000052007.jpg,Two people about to get on-board a bus. 
./coco_dataset/train2017/000000129054.jpg,A large group of zebras in a open field.
./coco_dataset/train2017/000000123321.jpg,A bowl of broccoli with sauce over it.
./coco_dataset/train2017/000000097022.jpg,An open kitchen is shown with light brown cabinets.
./coco_dataset/train2017/000000008277.jpg,A white plate topped wti chicken and a cup of guacamole.
./coco_dataset/train2017/000000182021.jpg,A MAN IS HOLDING A BASE BALL BAT STANDING AT THE DIRT
./coco_dataset/train2017/000000502599.jpg,Multiple planes hanging on top of a ceiling. 
./coco_dataset/train2017/000000121744.jpg,A tennis player looks up with his leg in the air as photographers snap photos.
./coco_dataset/train2017/000000291490.jpg,A cat laying on a blanket on top of a pillow. 
